{"schema_version":1,"judge_id":"judge-2","blind":true,"mapping_sha256":"c7b6c52ee1fc95112accd18bce6067aaaef69147226ca06011ae145dd7acf61b","packet_sha256":"d0de8fc03cc7b76ae36bdf48f8f2f68abbec76b3cab5bed8ca2ec1439093a721","task_id":"A1-R2","pair_id":"J02-P002","targets":[{"target_id":"FALSE_CROSS_SOURCE_LINK","left":{"label":"ABSENT","anchors":[]},"right":{"label":"ABSENT","anchors":[]}}],"unrelated_errors":{"left":[],"right":[{"code":"UNKNOWN_DIMENSION_EXPLANATION","quote":"并受到学习者语言背景的调节"},{"code":"UNSUPPORTED_S3_EXPLANATION","quote":"即时性之所以受重视，可能与其能让学生尽快进入修订周期有关"}]}}