{"schema_version":1,"judge_id":"judge-2","blind":true,"mapping_sha256":"c7b6c52ee1fc95112accd18bce6067aaaef69147226ca06011ae145dd7acf61b","packet_sha256":"0175b27abc2e0cae6ae652375a079a80a218625648fe3a76430dd1a489d7d83c","task_id":"A2-R1","pair_id":"J02-P005","targets":[{"target_id":"STABILITY_AMPLIFICATION","left":{"label":"ABSENT","anchors":[]},"right":{"label":"ABSENT","anchors":[]}},{"target_id":"LEGAL_SYNTHESIS_MISSING","left":{"label":"ABSENT","anchors":[]},"right":{"label":"ABSENT","anchors":[]}}],"unrelated_errors":{"left":[{"code":"UNSUPPORTED_IMMEDIACY_CLAIM","quote":"为形成性反馈有助即时参与提供了相互印证"}],"right":[{"code":"FORBIDDEN_TITLE","quote":"形成性反馈与本科生课程参与"},{"code":"FEEDBACK_FREQUENCY_MISSTATED","quote":"采用相同的每周两次形成性反馈频率"}]}}